Enter user-name: A021@db2021
Enter password:

Connected to:
Oracle Database 11g Release 11.2.0.1.0 - Production

SQL> create table employee(
  2  empid number(5),
  3  empname varchar2(20),
  4  gender char,
  5  dept varchar2(10));

Table created.

SQL> desc employee
 Name                                      Null?    Type
 ----------------------------------------- -------- ----------------------------
 EMPID                                              NUMBER(5)
 EMPNAME                                            VARCHAR2(20)
 GENDER                                             CHAR(1)
 DEPT                                               VARCHAR2(10)

SQL> create table employee1 as select * from employee
  2  create table employee1 as select * from employee;
create table employee1 as select * from employee
*
ERROR at line 2:
ORA-00933: SQL command not properly ended


SQL> create table employee1 as select * from employee;

Table created.

SQL> desc employee1
 Name                                      Null?    Type
 ----------------------------------------- -------- ----------------------------
 EMPID                                              NUMBER(5)
 EMPNAME                                            VARCHAR2(20)
 GENDER                                             CHAR(1)
 DEPT                                               VARCHAR2(10)

SQL> create table employee2 as select empid,empname from employee1
  2  ;

Table created.

SQL> desc employee2
 Name                                      Null?    Type
 ----------------------------------------- -------- ----------------------------
 EMPID                                              NUMBER(5)
 EMPNAME                                            VARCHAR2(20)

SQL> create table employee3 as select * from employee where 1>2;

Table created.

SQL> desc employee3
 Name                                      Null?    Type
 ----------------------------------------- -------- ----------------------------
 EMPID                                              NUMBER(5)
 EMPNAME                                            VARCHAR2(20)
 GENDER                                             CHAR(1)
 DEPT                                               VARCHAR2(10)

SQL> insert into employee values(1,'Navya','F','CSE');

1 row created.

SQL> desc employee
 Name                                      Null?    Type
 ----------------------------------------- -------- ----------------------------
 EMPID                                              NUMBER(5)
 EMPNAME                                            VARCHAR2(20)
 GENDER                                             CHAR(1)
 DEPT                                               VARCHAR2(10)

SQL> select * from employee
  2  ;

     EMPID EMPNAME              G DEPT
---------- -------------------- - ----------
         1 Navya                F CSE

SQL> insert into employee values(2,'Babbi','F','CSE');

1 row created.

SQL> select * from employee
  2  ;

     EMPID EMPNAME              G DEPT
---------- -------------------- - ----------
         1 Navya                F CSE
         2 Babbi                F CSE

SQL> create table employee3 as select * from employee where 1>2;
create table employee3 as select * from employee where 1>2
             *
ERROR at line 1:
ORA-00955: name is already used by an existing object


SQL> create table student(
  2  sid number(5),
  3  sname varchar2(20),
  4  sgender char,
  5  sage number(50),
  6  sdept char(10));
sage number(50),
            *

SQL> create table student(
  2  sid number(5),
  3  sname varchar2(20),
  4  sgender char,
  5  sage number(30),
  6  sdept char(10));

Table created.

SQL> desc student
 Name                                      Null?    Type
 ----------------------------------------- -------- ----------------------------
 SID                                                NUMBER(5)
 SNAME                                              VARCHAR2(20)
 SGENDER                                            CHAR(1)
 SAGE                                               NUMBER(30)
 SDEPT                                              CHAR(10)

SQL> insert into student values(58,'BHAVYA','F',19,'CSE');

1 row created.

SQL> insert into student values(45,'NAVATHA','F',19,'CSE');

1 row created.

SQL> insert into student values(21,'NAVYA','F',19,'CSE');

1 row created.

SQL> insert into student values(20,'DHANYA','F',19,'CSE');

1 row created.

SQL> insert into student values(34,'AISHWARYA','F',19,'CSE');

1 row created.

SQL> select * from student
  2  ;

       SID SNAME                S       SAGE SDEPT
---------- -------------------- - ---------- ----------
        58 BHAVYA               F         19 CSE
        45 NAVATHA              F         19 CSE
        21 NAVYA                F         19 CSE
        20 DHANYA               F         19 CSE
        34 AISHWARYA            F         19 CSE

SQL> create table student1 as select * from student where 1>2;

Table created.

SQL> desc student1
 Name                                      Null?    Type
 ----------------------------------------- -------- ----------------------------
 SID                                                NUMBER(5)
 SNAME                                              VARCHAR2(20)
 SGENDER                                            CHAR(1)
 SAGE                                               NUMBER(30)
 SDEPT                                              CHAR(10)

SQL> create table student1 as select * from student where 1>2;
create table student1 as select * from student where 1>2
             *
ERROR at line 1:
ORA-00955: name is already used by an existing object


SQL> create table student2 as select * from student where 1>2;

Table created.

SQL> select * from student
  2  ;

       SID SNAME                S       SAGE SDEPT
---------- -------------------- - ---------- ----------
        58 BHAVYA               F         19 CSE
        45 NAVATHA              F         19 CSE
        21 NAVYA                F         19 CSE
        20 DHANYA               F         19 CSE
        34 AISHWARYA            F         19 CSE

SQL> select * from student1;

no rows selected

SQL> create table student2 as select * from student where 58>45;
create table student2 as select * from student where 58>45
             *

SQL> create table student3 as select * from student where 58>45;

Table created.

SQL> desc student3
 Name                                      Null?    Type
 ----------------------------------------- -------- ----------------------------
 SID                                                NUMBER(5)
 SNAME                                              VARCHAR2(20)
 SGENDER                                            CHAR(1)
 SAGE                                               NUMBER(30)
 SDEPT                                              CHAR(10)

SQL> select * from student3;

       SID SNAME                S       SAGE SDEPT
---------- -------------------- - ---------- ----------
        58 BHAVYA               F         19 CSE
        45 NAVATHA              F         19 CSE
        21 NAVYA                F         19 CSE
        20 DHANYA               F         19 CSE
        34 AISHWARYA            F         19 CSE

SQL> insert into student(sid,sname) values(30,'KAVYA');

1 row created.

SQL> slect * from student
SP2-0734: unknown command beginning "slect * fr..." - rest of line ignored.
SQL> select * from student
  2  ;

       SID SNAME                S       SAGE SDEPT
---------- -------------------- - ---------- ----------
        58 BHAVYA               F         19 CSE
        45 NAVATHA              F         19 CSE
        21 NAVYA                F         19 CSE
        20 DHANYA               F         19 CSE
        34 AISHWARYA            F         19 CSE
        30 KAVYA

6 rows selected.

SQL> insert into student values(&sid,'&sname');
Enter value for sid: 42
Enter value for sname: BRINDA
old   1: insert into student values(&sid,'&sname')
new   1: insert into student values(42,'BRINDA')
insert into student values(42,'BRINDA')
            *


SQL> select * drom student
  2  ;
select * drom student
         *



SQL> select * from student;

       SID SNAME                S       SAGE SDEPT
---------- -------------------- - ---------- ----------
        58 BHAVYA               F         19 CSE
        45 NAVATHA              F         19 CSE
        21 NAVYA                F         19 CSE
        20 DHANYA               F         19 CSE
        34 AISHWARYA            F         19 CSE
        30 KAVYA

6 rows selected.

SQL> update student set sgender='M',sage=19,sdept='CSE' where sid=65;

1 row updated.

SQL> select * from student;

       SID SNAME                S       SAGE SDEPT
---------- -------------------- - ---------- ----------
        58 BHAVYA               F         19 CSE
        45 NAVATHA              F         19 CSE
        21 NAVYA                F         19 CSE
        20 DHANYA               F         19 CSE
        34 AISHWARYA            F         19 CSE
        30 KAVYA             F         19 CSE

6 rows selected.

SQL>